video_id,clip_id,transcription
-3g5yACwYnA,10,ON KEYS PART OF AH THE PEOPLE THAT WE USE TOTO SOLVE THOSE ISSUES WHETHER IT'S ON SCRATCH OR OUT DOOR RESISTANCE OR A OR O OBRASIONS OR DIFFERENT TECHNICAL ASPECTS THAT WE WE REALLY NEED ASSOLVE TO TO GET INTO NEW MARKETS THEY'V BEEN ABLE TO BRING SOLUTIONS
-3g5yACwYnA,13,THAT WE DO O THEY'VE BEEN ABLE TO FIND SOLUTIONS OR EARTLY SOPRING SOME MANCERS TO THE TABLE
-3g5yACwYnA,3,OM WE'RE A HUGE A USERVE IT HE SAYS FOR OUR OPERATION CALL FLOCKING AND WE DON'T HAVE THE TECHNICAL AND INSIDE INFOM COMPOUNDING OR THE TECHNICAL EXPRATIS TO DO THESE TYPES OF THINGS SO A KEYBRINGS
-3g5yACwYnA,2,ERATIONS AM KEE BRINGS THE KEEP ALROM BRINGS A TECHNICAL ASPECT TO AR OUR OPERATION THAT WE DON'T HAVE INTERNALLY AM WE
-3g5yACwYnA,4,KEY BRINGS THOSE TYPES OF A ASPECTS TO OUR BUSINESS ON ON NEW MARKETS NEW POTENTIALS AND A EVEN ON OUR EQUIPMENT OF HOW HOW THINGS ROT AND OPERATE WITH WITH A PRETTY LONG EXPERIENCE WITH THEIR TEAM
-3g5yACwYnA,9,WE HAVE MANY A NEW OPPORTUNITYE THROUGH THE WAY THINGS HAVE CHANGED TO THE YEARS ON LOOKING FOR NEW NICH HIGH AND VALUE AT A PRODUCTS AND
